{
    "$schema": "http://json-schema.org/draft-07/schema#",
    "type": "array",
    "items": {
        "type": "object",
        "properties": {
            "selfId": {
                "type": "integer"
            },
            "template": {
                "type": "object",
                "properties": {
                    "name": {
                        "type": "string"
                    },
                    "passive": {
                        "type": "boolean"
                    },
                    "spell": {
                        "type": "boolean"
                    },
                    "distance": {
                        "type": "integer"
                    }
                },
                "required": [
                    "name",
                    "passive",
                    "spell",
                    "distance"
                ]
            },
            "time": {
                "type": "object",
                "properties": {
                    "hitTime": {
                        "type": "integer"
                    },
                    "reuse": {
                        "type": "integer"
                    },
                    "buff": {
                        "type": "integer"
                    }
                },
                "required": [
                    "hitTime",
                    "reuse",
                    "buff"
                ]
            },
            "levels": {
                "type": "array",
                "items": {
                    "type": "object",
                    "properties": {
                        "level": {
                            "type": "integer"
                        },
                        "power": {
                            "type": "number"
                        },
                        "mp": {
                            "type": "integer"
                        },
                        "hp": {
                            "type": "integer"
                        },
                        "itemId": {
                            "type": "integer"
                        },
                        "itemCount": {
                            "type": "integer"
                        }
                    },
                    "required": [
                        "level",
                        "power",
                        "mp",
                        "hp",
                        "itemId",
                        "itemCount"
                    ]
                }
            }
        },
        "required": [
            "selfId",
            "template",
            "time",
            "levels"
        ]
    }
}
